,id,replyCount,likeCount,published_at,author_name,text,authorChannelId,is_reply,threadId,video_id,video_published_at
187,UgzQfwvkIlc1eonUvrR4AaABAg.8xAMRPG7eqc8xAfpVKsGKA,,0,2019-07-09 18:18:57,Ryan Wilson,but span 🤦‍♂️,UCdZZ4wyvfzYaCMcNbmFmMcQ,1,UgzQfwvkIlc1eonUvrR4AaABAg,YeX14s2H3Qo,2019-07-08 16:32:52
188,UgzQfwvkIlc1eonUvrR4AaABAg.8xAMRPG7eqc8xAdmuDe44y,,0,2019-07-09 18:01:07,but span,@Ryan Wilson if oxygen is not a problem as once the fossil fuels are going to dries up there going to change to algae based bio fuels and algae produces more oxygen than trees.,UCBHI_RMWkvHeTToEBrQPa0Q,1,UgzQfwvkIlc1eonUvrR4AaABAg,YeX14s2H3Qo,2019-07-08 16:32:52
189,UgzQfwvkIlc1eonUvrR4AaABAg.8xAMRPG7eqc8xAZsQBhwZK,,0,2019-07-09 17:18:11,Ryan Wilson,Joop People also need oxygen.,UCdZZ4wyvfzYaCMcNbmFmMcQ,1,UgzQfwvkIlc1eonUvrR4AaABAg,YeX14s2H3Qo,2019-07-08 16:32:52
190,UgzQfwvkIlc1eonUvrR4AaABAg.8xAMRPG7eqc8xAYXZ5vCdD,,0,2019-07-09 17:06:27,Joop,people need wood man,UC-1Kg-MDWr681y8ZM_wlVtA,1,UgzQfwvkIlc1eonUvrR4AaABAg,YeX14s2H3Qo,2019-07-08 16:32:52
191,UgymFsEknVIlMeUMUF54AaABAg,1.0,0,2019-07-09 16:00:31,Sean Bishop,If co2 levels are rising the best thing to do is plant trees to lower co2 levels . More green space is good for the planet .... Plant a tree help keep the planet healthy ....,UCC4nxYqZ6IL0uEat9fB7AnA,0,UgymFsEknVIlMeUMUF54AaABAg,YeX14s2H3Qo,2019-07-08 16:32:52
192,UgymFsEknVIlMeUMUF54AaABAg.8xAQzcaNtA18xAzeQeI6gd,,0,2019-07-09 21:12:12,Eric Cole,Explore Permaculture designed Food Forest. Become an agent of change plant one in your yard !,UCp_WOaHE3pwKc4ezYgv0Whw,1,UgymFsEknVIlMeUMUF54AaABAg,YeX14s2H3Qo,2019-07-08 16:32:52
193,UgyAKKZZrfOPnCK7Yit4AaABAg,0.0,0,2019-07-10 10:12:44,drkstrong,Problem is that we are cutting down more trees than we are planting and many of the trees we are planting are the wrong sort (palm oil). Second trees take up arable land and so we have less land to feed ourselves.,UCIp0KTgnQNZJIOQZqrVDw1g,0,UgyAKKZZrfOPnCK7Yit4AaABAg,YeX14s2H3Qo,2019-07-08 16:32:52
194,UgyCwx4z5r7sp48mS4J4AaABAg,0.0,0,2019-07-09 15:28:20,Lag Swag,What about EPSTEIN?,UCIMwCnta85hECdtcXtRPKMg,0,UgyCwx4z5r7sp48mS4J4AaABAg,YeX14s2H3Qo,2019-07-08 16:32:52
195,UgxlgyLZbfV1_cKdMsR4AaABAg,0.0,0,2019-07-09 15:12:56,qazyman,Fake news.,UCi9r-J6453S_VLi-GP1QNuA,0,UgxlgyLZbfV1_cKdMsR4AaABAg,YeX14s2H3Qo,2019-07-08 16:32:52
196,UgysMGwrYud9OWfb9lN4AaABAg,0.0,0,2019-07-08 16:52:36,Tseleng Botlhole,New study??? Where have they been all these years??? 🤔🤔🤔,UCUncAN3xarBuzqQt9q2q56A,0,UgysMGwrYud9OWfb9lN4AaABAg,YeX14s2H3Qo,2019-07-08 16:32:52
197,UgwO3VtZUHcUky3lO154AaABAg,0.0,0,2019-07-09 19:45:43,Rockin BoBokkin,"I mean....duh. seriously. This is knowledge over 30 years old. Deforestation is more to blame than driving cars for climate change. Also, adopting hemp growth in America.",UC6lnjCLgXSCytHuh8_j3RkA,0,UgwO3VtZUHcUky3lO154AaABAg,YeX14s2H3Qo,2019-07-08 16:32:52
198,Ugzjxo1XAVQHBrP6gy14AaABAg,0.0,0,2020-02-23 19:13:27,Tom Anderson,"If everyone planted trees such as Apple, citrus, cherries, peaches, etc in the appropriate type of climate they have of course. Two birds one stone.",UCfBctwxQCTRQCklNJ3P8HIQ,0,Ugzjxo1XAVQHBrP6gy14AaABAg,YeX14s2H3Qo,2019-07-08 16:32:52
199,UgzPZrPVf3t3Fyjxm7V4AaABAg,0.0,0,2019-07-09 19:29:37,Meetul Trivedi,In africa they are cutting tree big uk companies are buying timber.more trees planted if so still big tertiary countries gonna cut emm.,UCIiwx-pddHXXlKsG0ipXipA,0,UgzPZrPVf3t3Fyjxm7V4AaABAg,YeX14s2H3Qo,2019-07-08 16:32:52
200,Ugwh6BCdLH14jQft0GB4AaABAg,0.0,2,2019-07-08 19:03:36,Doc Tom,"reversing population growth would be a better solution,to improving the environment in so many ways... THINK ABOUT IT!!!",UChE31ml5t7SeDhwBbPX7GBQ,0,Ugwh6BCdLH14jQft0GB4AaABAg,YeX14s2H3Qo,2019-07-08 16:32:52
201,UgwZakwVqexPAoC4nu94AaABAg,1.0,0,2019-07-09 19:56:53,Angie B,FAKE NEWS!! We have more trees now than ever.,UCjcm4pZ3oSTmQP-DNse4kgw,0,UgwZakwVqexPAoC4nu94AaABAg,YeX14s2H3Qo,2019-07-08 16:32:52
202,UgwZakwVqexPAoC4nu94AaABAg.8xAr1nuQGvG8xAzD4XU8qj,,0,2019-07-09 21:08:20,Eric Cole,You can become an agent of change instead of a Negative Nelly. Investigate a Permaculture designed Food forest installed in your yard. Instead you want others to fix a problem. Snow flake ! Prove me wrong!,UCp_WOaHE3pwKc4ezYgv0Whw,1,UgwZakwVqexPAoC4nu94AaABAg,YeX14s2H3Qo,2019-07-08 16:32:52
203,Ugzh2oD7NiKcxPJJffJ4AaABAg,0.0,0,2020-04-26 04:18:36,Linda Rockower,Join &quot;8 billion trees&quot; A cooperative effort. 20 bucks is the low monthly fee &amp; by subscribing you are funding 10 trees to be planted each month.,UCBkwnGv1MbeDu_IbHkl_i3g,0,Ugzh2oD7NiKcxPJJffJ4AaABAg,YeX14s2H3Qo,2019-07-08 16:32:52
204,UgyiYDmhF_MMyQYDUqV4AaABAg,0.0,2,2019-07-08 16:34:22,potatomato :p,Call 1 billion nature&#39;s prophets.,UCsXijYpRRcZhYkbfObJanfw,0,UgyiYDmhF_MMyQYDUqV4AaABAg,YeX14s2H3Qo,2019-07-08 16:32:52
205,UgxWXWUQL_WSmsM_sC94AaABAg,2.0,1,2019-07-08 19:26:33,John Smith,"Get prisoners from jails to plant trees in every locale and jurisdiction, better than lifting weights all day long and being bored. For every tree you plant, you get 20 minutes off your sentence.",UChFp2-EgX8cMBGj8hN71Cmg,0,UgxWXWUQL_WSmsM_sC94AaABAg,YeX14s2H3Qo,2019-07-08 16:32:52
206,UgxWXWUQL_WSmsM_sC94AaABAg.8x8DlgktFo58x8HIaH_w36,,1,2019-07-08 19:57:23,John Smith,"@MCライド Non-violent crimes, child-support, shoplifting, etc.",UChFp2-EgX8cMBGj8hN71Cmg,1,UgxWXWUQL_WSmsM_sC94AaABAg,YeX14s2H3Qo,2019-07-08 16:32:52
207,UgxWXWUQL_WSmsM_sC94AaABAg.8x8DlgktFo58x8EckgeUIA,,0,2019-07-08 19:34:03,MCライド,"John Smith i mean, for people with not as serious offences, right?",UCaNbTKZYgjZyPcoPPS00Dow,1,UgxWXWUQL_WSmsM_sC94AaABAg,YeX14s2H3Qo,2019-07-08 16:32:52
208,Ugy7hfm1K_VmonVTNq94AaABAg,0.0,1,2019-07-09 23:17:11,Riley Knight,"Speaking as an arborist, one critical component is species selection. Selection of species that are large canopy trees and that have high carbon sequestration rates is one of the most effective ways to accomplish this. As mentioned in the video though it&#39;s also important to have understory trees and plant material to support the overall ecosystem of that space. This is an amazingly easy and relatively inexpensive way to address this issue or at least make a considerable dent. It does however as mentioned take future planning. Most trees will take ~20+ years to grow large enough to where you will begin to realize these benefits. The larger the tree the greater the overall net benefits. Speaking as a municipal arborist, there are also many untapped opportunities to add to Urban forests as well, so while planting large swaths of forests in open spaces is a great use of unused land, we can also plant in Urban space where there is greater concentrated pollution. Urban factors often shorten the average lifespan of trees but the service they provide in these spaces are just as important.",UCStJ_JsKrgrdX1igdF8Audg,0,Ugy7hfm1K_VmonVTNq94AaABAg,YeX14s2H3Qo,2019-07-08 16:32:52
209,UgxdB-I4w4JzQSS2M014AaABAg,0.0,1,2019-07-08 18:38:49,Tammy Powell,PLANT EVERY TREE YOU CAN POSSIBLY FIND BUT IT WON’T CHANGE ANYTHING. THE END TIMES.....SEE THE BIBLE 💯,UCBP65dPJWSoNF197ElM9PwQ,0,UgxdB-I4w4JzQSS2M014AaABAg,YeX14s2H3Qo,2019-07-08 16:32:52
210,UgyTTIMsfj35XpCVsqV4AaABAg,0.0,0,2021-01-01 18:23:06,Sheetal Bhalerao,"Start planting from sea-coast area.Plant trees suitable for climate,soil of the regions such as coconut Jackfruit jamun mango cocum banyan peeple,umber arjuna coconut cottonwood, &amp; other trees. With the help of sea water it will help to fasten the project to green the regions on large scale",UCAAoIGSzWXZBQ_YOCrMnGNw,0,UgyTTIMsfj35XpCVsqV4AaABAg,YeX14s2H3Qo,2019-07-08 16:32:52
211,UgyMTcrhq2CMav6vVRd4AaABAg,0.0,2,2019-07-08 21:44:08,Bob Smith,I say we plow over Washington DC and put trees up instead - America would get much more benefit than what is there now.,UCFSpIpqlruRnFXJar1WC_GQ,0,UgyMTcrhq2CMav6vVRd4AaABAg,YeX14s2H3Qo,2019-07-08 16:32:52
212,Ugwxv0B6JGc9gtkiHn54AaABAg,0.0,1,2019-07-08 18:37:24,M. Happy,Stop cutting down the millions of OLD trees you&#39;re cutting down for soft fluffy toilet paper and we might actually stand a chance.,UCDek6g8NqaC6JW5TBYvvAYA,0,Ugwxv0B6JGc9gtkiHn54AaABAg,YeX14s2H3Qo,2019-07-08 16:32:52
213,Ugz3SZmkIKQjE9RX9th4AaABAg,0.0,0,2019-07-10 21:34:39,Boran Theki,"We need more atmospheric CO2, not less.",UC6azqDSlA7fhXYXXKRKKuSQ,0,Ugz3SZmkIKQjE9RX9th4AaABAg,YeX14s2H3Qo,2019-07-08 16:32:52
214,UgzBc-kjO4peVTYLOkR4AaABAg,2.0,2,2019-07-09 16:03:01,ITCHYisVegeta,"The year 1986 called, they want their news back. Jesus freaking Christ, have none of these people heard of photosynthesis?",UCi2qgFmfghKVxGx68guidYw,0,UgzBc-kjO4peVTYLOkR4AaABAg,YeX14s2H3Qo,2019-07-08 16:32:52
215,UgzBc-kjO4peVTYLOkR4AaABAg.8xARGtu1jFs8xBMrtr7hiE,,0,2019-07-10 00:43:45,ITCHYisVegeta,"@Clara Jane There was proof then too. Again, Photosynthesis.",UCi2qgFmfghKVxGx68guidYw,1,UgzBc-kjO4peVTYLOkR4AaABAg,YeX14s2H3Qo,2019-07-08 16:32:52
216,UgzBc-kjO4peVTYLOkR4AaABAg.8xARGtu1jFs8xAgUnsHk5h,,0,2019-07-09 18:24:43,Clara Jane,The news is that there is proof now that this as a viable solution,UCVgIA2vXjQPHj8vdXoUKQIQ,1,UgzBc-kjO4peVTYLOkR4AaABAg,YeX14s2H3Qo,2019-07-08 16:32:52
217,UgyGhnlxx1HurqVw9hx4AaABAg,1.0,0,2019-07-09 03:41:01,Tyler Moses WESTBOUND EDUCATION HUB,"subdivisions.... American ignorance, paying someone to tell you what color os mini blinds you can have or monitoring the landscape. ignorance......",UCojj-mNLx0K5FlWymAkIjNg,0,UgyGhnlxx1HurqVw9hx4AaABAg,YeX14s2H3Qo,2019-07-08 16:32:52
218,UgyGhnlxx1HurqVw9hx4AaABAg.8x96MH2uu898xB1pW8tFC4,,0,2019-07-09 21:39:55,Eric Cole,Or you can be an agent of change and plant a Permaculture designed food forest in your yard. You are stuck being a problem when there is an easy solution!,UCp_WOaHE3pwKc4ezYgv0Whw,1,UgyGhnlxx1HurqVw9hx4AaABAg,YeX14s2H3Qo,2019-07-08 16:32:52
219,UgzDwfkLto4n4HIOMoF4AaABAg,0.0,0,2019-07-09 16:07:58,Rea Ality,"If you really care about the environment you would be anti-socialist. Let the free market provide clean air, clean water, and the safe environment people want and are willing to pay for. Forcing Americans to pay through taxation and regulation will backfire.",UCRLjkJ5_2g7XL0faV4NbxXg,0,UgzDwfkLto4n4HIOMoF4AaABAg,YeX14s2H3Qo,2019-07-08 16:32:52
220,Ugzg0OvnbaWMCUtbv2J4AaABAg,0.0,0,2019-07-08 16:47:16,Lia Mari,China is already doing it.,UC40jazI1T8kM5HKkegsX6jQ,0,Ugzg0OvnbaWMCUtbv2J4AaABAg,YeX14s2H3Qo,2019-07-08 16:32:52
221,UgyNdPLmOK9oTeL6Dvh4AaABAg,0.0,0,2019-07-08 16:52:20,WulfCry,"Genius 30 years ago someone said the same thing, But you kids wouldn&#39;t know like I did when 40 years ago previous, someone also said &quot;if we don&#39;t &quot;. And today a genius says it again I&#39;m baffled. Lets go outside and hug our tree&#39;s again.<br /><br /><br /><br /><br />(lets make good journalism great again)",UCMQxKWpqv0ijRgJW0-KUcOQ,0,UgyNdPLmOK9oTeL6Dvh4AaABAg,YeX14s2H3Qo,2019-07-08 16:32:52
222,Ugx_HwxqFnA3EaEuWnt4AaABAg,0.0,1,2019-07-08 16:37:17,Sef Eiba,Humans don&#39;t take this seriously,UCZyLH-HGMgA-vgt-nMEN24w,0,Ugx_HwxqFnA3EaEuWnt4AaABAg,YeX14s2H3Qo,2019-07-08 16:32:52
223,Ugwo3n9DdT5zUUTRVCx4AaABAg,4.0,3,2019-07-08 16:45:02,Uncle Beardo,"Why is the earth heating up? Why are areas that were previously too cold for rapid tree growth now warming enough to make it possible? Why are birds, animals, and insects all on the increase? Because the planet is fixing itself, making it more conducive to the plants that are needed to clean itself up. We live on a living planet, and we arrogantly think we know what&#39;s best for it, even though we&#39;ve repeatedly proven we don&#39;t know jack about squat.",UC79BX9e8ll6dUJ6oRHq7fUQ,0,Ugwo3n9DdT5zUUTRVCx4AaABAg,YeX14s2H3Qo,2019-07-08 16:32:52
224,Ugwo3n9DdT5zUUTRVCx4AaABAg.8x7wHk8Qkm-8x8FPZh0qEa,,0,2019-07-08 19:40:52,Uncle Beardo,@Jerome Lund Comes in a bottle from Tennessee,UC79BX9e8ll6dUJ6oRHq7fUQ,1,Ugwo3n9DdT5zUUTRVCx4AaABAg,YeX14s2H3Qo,2019-07-08 16:32:52
225,Ugwo3n9DdT5zUUTRVCx4AaABAg.8x7wHk8Qkm-8x8FIofxq2s,,0,2019-07-08 19:39:56,Uncle Beardo,"@Scholoryteller Climate change also caused mile thick layers of ice to form over various parts of the world, covering billions of square miles and ending millions of species.",UC79BX9e8ll6dUJ6oRHq7fUQ,1,Ugwo3n9DdT5zUUTRVCx4AaABAg,YeX14s2H3Qo,2019-07-08 16:32:52
226,Ugwo3n9DdT5zUUTRVCx4AaABAg.8x7wHk8Qkm-8x80RbEYpQS,,0,2019-07-08 17:30:04,Scholoryteller,"I've wondered if it's such a bad thing for more habitable land to open up in Greenland and Antarctica. However, climate change is believed to be causing frequent hurricanes and toxic algae blooms.",UCAikbbRGx_4ug-_8VtIWzIg,1,Ugwo3n9DdT5zUUTRVCx4AaABAg,YeX14s2H3Qo,2019-07-08 16:32:52
227,Ugwo3n9DdT5zUUTRVCx4AaABAg.8x7wHk8Qkm-8x7xUMUjd_w,,2,2019-07-08 16:55:29,JJ Johnson,Got that right on target sir!,UCbnTww0VfIqMfB58p_C4sFA,1,Ugwo3n9DdT5zUUTRVCx4AaABAg,YeX14s2H3Qo,2019-07-08 16:32:52
228,Ugywdy_-kfDcjqu82yt4AaABAg,1.0,0,2019-07-09 15:59:57,Mike Powell,"Properly grazed grasslands will do it better and faster.<br />Not against planting trees just saying grazing can sequester carbon faster, increase meat production and improve soil health.",UCb4t-QQWwnpt08angrrnCCw,0,Ugywdy_-kfDcjqu82yt4AaABAg,YeX14s2H3Qo,2019-07-08 16:32:52
229,Ugywdy_-kfDcjqu82yt4AaABAg.8xAQvNhHkVU8xAtbghDIpN,,0,2019-07-09 20:19:24,Eric Cole,You also can be an agent of change and install a Permaculture designed food forest.,UCp_WOaHE3pwKc4ezYgv0Whw,1,Ugywdy_-kfDcjqu82yt4AaABAg,YeX14s2H3Qo,2019-07-08 16:32:52
230,UgyK2yfCyKjGxyrpxl54AaABAg,0.0,0,2019-07-08 16:42:51,Shyan Jam,"If Europeans are happy with the Islamic rule and Mullah, and they love them, they must bring Mullah and the Islamic regime to Europe and give them power in Europe.",UC-i3SlM8EF5Nm9jSheo2LTA,0,UgyK2yfCyKjGxyrpxl54AaABAg,YeX14s2H3Qo,2019-07-08 16:32:52
