,id,replyCount,likeCount,published_at,author_name,text,authorChannelId,is_reply,threadId,video_id,video_published_at
68,UgwDZuRKfi_lHTerFbN4AaABAg.95qCkQoay5H95qG5_ZemwL,,2,2020-03-05 23:55:14,⸻⸻JonBud⸻⸻⸻⸻⸻⸻⸻⸻⸻⸻⸻⸻⸻⸻⸻⸻⸻⸻⸻⸻⸻⸻⸻⸻⸻⸻⸻⸻⸻⸻⸻⸻⸻⸻⸻⸻⸻⸻⸻⸻,"I intentionally grew trees and a few bushes around my yard at my previous residence, in addition to native Amaranth to eat the leaves and use the seeds as a grain (like my Wixaritari ancestors). Every leafy green surface adds to the overall surface area of plant matter converting CO2. Every branch is a little less CO2 in the air, since that's what the branches are primarily made of. I still grow herbs in my windowsill. I still convince my family and former roommates to use live pine trees for Christmas and I help to transplant them in the spring. Now that I'm temporarily in an apartment, I replaced one of my lightbulbs with a (slightly less effective, but it's power consumption was roughly equivalent to the previous bulb) grow light to supplement the light from the window. The wonderful thing about plants, is that if there's a slight decrease in the global levels of CO2, they'll just grow slower. It doesn't seem like a bad idea to grow more plants as a means of personal contribution to lowering CO2 in the atmosphere. Some plants (like a hanging pot of Creeping Jenny) are fairly hardy and don't require a lot of attention and will bounce right back if you don't water them for over a week (like if you went on a trip and left them inside).",UC3RzKMz4PGQihsLQrGECCaQ,1,UgwDZuRKfi_lHTerFbN4AaABAg,fRF245N-qPs,2020-03-05 22:30:00
69,UgxMJuB3vrHOaVXwEL14AaABAg,0.0,2,2020-03-05 22:34:57,Agent Matt,Hell on Earth,UCMunR-68oVffCoCDLkNP63w,0,UgxMJuB3vrHOaVXwEL14AaABAg,fRF245N-qPs,2020-03-05 22:30:00
70,Ugz2QVcWRfzcuONSPIF4AaABAg,0.0,4,2020-03-05 22:48:00,Georges Cote,Good report.biden &#39;s lack of concern for the climate change is irresponsible. Voting for half a trump (biden)is not enough .People have to be awaken and vote for Bernie Sanders .,UCfGopK5OSj5MB1obE1OLarA,0,Ugz2QVcWRfzcuONSPIF4AaABAg,fRF245N-qPs,2020-03-05 22:30:00
71,Ugy4GNqxAUWg0whHzMN4AaABAg,1.0,3,2020-03-05 23:37:30,John Brown,"I don&#39;t know the nitty-gritty details of deforestation in the Amazon but I have been following the issue there for close to 20 years.<br /><br /><br />Please don&#39;t forget that Cambodia&#39;s primary forest cover also fell dramatically, from over 70% in 1970 at the end of the Vietnam War to just 3.1% in 2007, when less than 3,220 square kilometers of primary forest remained. In 1973 there were 13.1 million hectares of total forest, but by 2014 the total cover had fallen to 8.7 million hectares. In October 2017, newly released data showed that Cambodian forests were cleared in 2016 at a rate of 30% higher than in 2015. There are almost no trees left now which has destroyed eco-tourism and led to the GREEDMONSTERS now fighting over the last few toothpicks that remain.WHY? Corrupt authoritarian leader Hun Sen and his crony capitalist friends have been lining their pockets FOR DECADES as they carryout MASSIVE ILLEGAL logging operations, that is why. They are so GREEDY that in 2012, the well-known environmental activist Chut Wutty was SHOT AND KILLED and numerous other forest rangers have been killed since WITHOUT ANY independent investigations being launched. <br /> <br />Deforestation is proceeding at an alarming rate: nearly 75% of forest loss has occurred since the end of the 1990s. Poachers &amp; corrupt one-party state officials are profiting from the black market trade in rare wood species, which is being exported to Vietnam — and beyond, to places like China &amp; Europe where it ends up with a far higher price tag. Why is the price tag higher? Because the wood has been used to manufacture luxury furniture in upscale European stores. <br /> <br />Cambodia has one of the top 5 deforestation rates in the world &amp; the Southeast Asian Rainforest is 5th largest in the world. The despotic dictators out here first designate forested areas Wildlife Sanctuaries, get the Military they control to guard the trees or cut them down for cronies, smuggle the wood out of the country and the pass the money up the ladder to the boss men. How in the world do you think a leader such as Hun Sen can afford to OWN A THREE MILLION DOLLAR WRISTWATCH and accumulate a couple of BILLION DOLLARS for his family on a salary of around 30,000 bucks a year? Pretty cool huh?<br /> <br /><a href=""http://www.youtube.com/results?search_query=%23HunSenRegime"">#HunSenRegime</a> <a href=""http://www.youtube.com/results?search_query=%23Corruption"">#Corruption</a> <a href=""http://www.youtube.com/results?search_query=%23Deforestation"">#Deforestation</a> <a href=""http://www.youtube.com/results?search_query=%23Enviironment"">#Enviironment</a> <a href=""http://www.youtube.com/results?search_query=%23ForestCrime"">#ForestCrime</a> <a href=""http://www.youtube.com/results?search_query=%23Murder"">#Murder</a> <a href=""http://www.youtube.com/results?search_query=%23Autoritarianism"">#Autoritarianism</a> <a href=""http://www.youtube.com/results?search_query=%23IllegalLogging"">#IllegalLogging</a> <a href=""http://www.youtube.com/results?search_query=%23Furniture"">#Furniture</a> <a href=""http://www.youtube.com/results?search_query=%23Smuggling"">#Smuggling</a> <a href=""http://www.youtube.com/results?search_query=%23LandGrabbingg"">#LandGrabbingg</a> <a href=""http://www.youtube.com/results?search_query=%23HumanRights"">#HumanRights</a> <a href=""http://www.youtube.com/results?search_query=%23Tyrannt"">#Tyrannt</a> <a href=""http://www.youtube.com/results?search_query=%23Dystopia"">#Dystopia</a> <a href=""http://www.youtube.com/results?search_query=%23Cambodia"">#Cambodia</a> <a href=""http://www.youtube.com/results?search_query=%23Vietman"">#Vietman</a> <a href=""http://www.youtube.com/results?search_query=%23Wood"">#Wood</a>",UCK4PSkyM1irQFYU-qFkGVzQ,0,Ugy4GNqxAUWg0whHzMN4AaABAg,fRF245N-qPs,2020-03-05 22:30:00
72,Ugy4GNqxAUWg0whHzMN4AaABAg.95qE3cJ-JZk95qMuoz9vNX,,0,2020-03-06 00:54:48,⸻⸻JonBud⸻⸻⸻⸻⸻⸻⸻⸻⸻⸻⸻⸻⸻⸻⸻⸻⸻⸻⸻⸻⸻⸻⸻⸻⸻⸻⸻⸻⸻⸻⸻⸻⸻⸻⸻⸻⸻⸻⸻⸻,"Are you also growing herbs, bushes, and trees to return carbon to the soil? The more people doing it, the better.",UC3RzKMz4PGQihsLQrGECCaQ,1,Ugy4GNqxAUWg0whHzMN4AaABAg,fRF245N-qPs,2020-03-05 22:30:00
73,UgzjFByoj6KNZZaeslh4AaABAg,0.0,0,2020-03-05 23:45:11,Joe Dance,"Well said! ‘Systems’ have feedback loops, and the environment has many. Many feedback loops have non-linear response mechanisms - i.e., they accelerate at an increasing rate. We see this behavior every day, in steering systems, in computers, software, and elsewhere - but most people just take it for granted, oblivious to what is actually going on. In my experience, <br />people in general seem to have trouble with the idea of non-linear feedback.",UCPgW_q22ds31LlEpl9cnh5Q,0,UgzjFByoj6KNZZaeslh4AaABAg,fRF245N-qPs,2020-03-05 22:30:00
74,UgzetwiAyyM80g0dlg94AaABAg,0.0,2,2020-03-06 17:16:34,faarsight,Well if you didn&#39;t vote for Bernie (and are a US citizen living in one of the states that already voted) you have no right to complain that nothing is being done about Global Warming,UCyEaY8b83JeiiVDftMnExNg,0,UgzetwiAyyM80g0dlg94AaABAg,fRF245N-qPs,2020-03-05 22:30:00
75,UgyHmVADEB9X2aaGR9x4AaABAg,8.0,6,2020-03-06 23:01:38,Robert Madden,"Why are most politicians, in the US anyway, examples of the densest form of human consciousness? I would think scientists and policy makers should be working hand in hand, together to provide society with the most current information and enacting laws that protect the citizenry, as well as, our environment.",UCmjf_YxmCi40-KtVWElQuIA,0,UgyHmVADEB9X2aaGR9x4AaABAg,fRF245N-qPs,2020-03-05 22:30:00
76,UgyHmVADEB9X2aaGR9x4AaABAg.95sjkpj0g_b96-vXzFUNR8,,0,2020-03-10 03:18:31,Robert Madden,R Needham Absolutely right.,UCmjf_YxmCi40-KtVWElQuIA,1,UgyHmVADEB9X2aaGR9x4AaABAg,fRF245N-qPs,2020-03-05 22:30:00
77,UgyHmVADEB9X2aaGR9x4AaABAg.95sjkpj0g_b96-DO1wCgVe,,1,2020-03-09 20:43:57,R Needham,"No we are, we put them in office!",UCoRiR79ktawpxWaDqP2kBqQ,1,UgyHmVADEB9X2aaGR9x4AaABAg,fRF245N-qPs,2020-03-05 22:30:00
78,UgyHmVADEB9X2aaGR9x4AaABAg.95sjkpj0g_b95vEbsGHHsn,,1,2020-03-07 22:18:31,DougiE,💰 💰💵💵🤑🤑🤑🤑💰💰,UCvuKPOVRLrMPyXNpzPzfRGQ,1,UgyHmVADEB9X2aaGR9x4AaABAg,fRF245N-qPs,2020-03-05 22:30:00
79,UgyHmVADEB9X2aaGR9x4AaABAg.95sjkpj0g_b95uy5TB1jyd,,1,2020-03-07 19:45:24,Persephone's Daughter,Corruption and greed. The fecal matter of capitalism.,UCMk30E7QCGJUqpivBLRrL8A,1,UgyHmVADEB9X2aaGR9x4AaABAg,fRF245N-qPs,2020-03-05 22:30:00
80,UgyHmVADEB9X2aaGR9x4AaABAg.95sjkpj0g_b95udHsv2l6Y,,1,2020-03-07 16:43:36,Sangui,Because of greed.,UCfZH6PiMJ3-Gl9ziD4GfjdA,1,UgyHmVADEB9X2aaGR9x4AaABAg,fRF245N-qPs,2020-03-05 22:30:00
81,UgyHmVADEB9X2aaGR9x4AaABAg.95sjkpj0g_b95uHEslcbsA,,1,2020-03-07 13:22:13,Ricky Williams,"Christian conservatives that think it is God’s will. They don’t believe in math or science, so they think it is all God’s work and the world ending is his way. A lot of them are our policy makers.",UCHIxPBfXlu8R7mpKIBcKdHQ,1,UgyHmVADEB9X2aaGR9x4AaABAg,fRF245N-qPs,2020-03-05 22:30:00
82,UgyHmVADEB9X2aaGR9x4AaABAg.95sjkpj0g_b95tFF9HIwfM,,2,2020-03-07 03:45:32,Justin Shim,Because the politicians have been bought by the fossil fuel industry.,UCJZ-KUbgtVsfn9iI0simiuA,1,UgyHmVADEB9X2aaGR9x4AaABAg,fRF245N-qPs,2020-03-05 22:30:00
83,UgyHmVADEB9X2aaGR9x4AaABAg.95sjkpj0g_b95skVF8tA8-,,0,2020-03-06 23:08:06,JaKalen Fells,I'd even go far as to say environment> citizens,UChnWjJoc9t99ImU8-bNIKWw,1,UgyHmVADEB9X2aaGR9x4AaABAg,fRF245N-qPs,2020-03-05 22:30:00
84,UgzORudB7rKrfmOuuXt4AaABAg,1.0,1,2020-03-05 23:12:45,Rob Pratt,Any right wing nut will just say they are smarter then the scientific commune.,UC9dptWINktM_bYArOHvbflQ,0,UgzORudB7rKrfmOuuXt4AaABAg,fRF245N-qPs,2020-03-05 22:30:00
85,UgzORudB7rKrfmOuuXt4AaABAg.95qBEMyDflH95qD2de6JLh,,0,2020-03-05 23:28:37,Rob Pratt,@game over man 69 ya I can concede to that,UC9dptWINktM_bYArOHvbflQ,1,UgzORudB7rKrfmOuuXt4AaABAg,fRF245N-qPs,2020-03-05 22:30:00
86,UgykwoTpbBSfB0zAqnV4AaABAg,2.0,3,2020-03-05 22:58:18,Peter Jansen,Can&#39;t we put a big fence around any Rainforest and shoot anyone who enters it without permission like companies which cut trees? And only give permission to enter those Rainforests in the case of some researchers. That would be awesome.,UCOS1SnRMeqJtsxWbLaRmIEw,0,UgykwoTpbBSfB0zAqnV4AaABAg,fRF245N-qPs,2020-03-05 22:30:00
87,UgykwoTpbBSfB0zAqnV4AaABAg.95q9__TVv0a95qHLBVVm1j,,0,2020-03-06 00:06:07,Gibbypastrami,@game over man 69 ight idk bout allat,UCLSvveaOKzxXjUqH_R9Hr-g,1,UgykwoTpbBSfB0zAqnV4AaABAg,fRF245N-qPs,2020-03-05 22:30:00
88,UgykwoTpbBSfB0zAqnV4AaABAg.95q9__TVv0a95qAmYHxPqO,,0,2020-03-05 23:08:49,Gibbypastrami,Maybe... build a wall??,UCLSvveaOKzxXjUqH_R9Hr-g,1,UgykwoTpbBSfB0zAqnV4AaABAg,fRF245N-qPs,2020-03-05 22:30:00
89,Ugw9bjYpCr3i_IC0cHZ4AaABAg,0.0,0,2020-03-10 20:34:31,Joost mag 't weten,Under hot and dry conditions photosynthesis temporarily stops to avoid water loss. Rotting vegetation will still emit CO2 though so overall a forest will create less oxigen under these conditions. on the other hand the increased CO2 content does make plants more drought resistant because photosynthesis is more efficient.,UCLi1-_ymuqFEa9PWwqIk5oA,0,Ugw9bjYpCr3i_IC0cHZ4AaABAg,fRF245N-qPs,2020-03-05 22:30:00
90,UgzAdAfR2trM-DWKcp94AaABAg,1.0,1,2020-03-05 22:44:15,ALA87,"can we please address this like actual adults and intelligently instead of this constant anti-science pro fossil fuel ignorant nonsense. This is so pitiful, when we could actually be adapting to this in a lot of ways and changing our highly inefficient just consume societies.",UCG36ehuceEduNRSGjrRFrLg,0,UgzAdAfR2trM-DWKcp94AaABAg,fRF245N-qPs,2020-03-05 22:30:00
91,UgzAdAfR2trM-DWKcp94AaABAg.95q7yfezfBq95qN7MRudDP,,0,2020-03-06 00:56:39,⸻⸻JonBud⸻⸻⸻⸻⸻⸻⸻⸻⸻⸻⸻⸻⸻⸻⸻⸻⸻⸻⸻⸻⸻⸻⸻⸻⸻⸻⸻⸻⸻⸻⸻⸻⸻⸻⸻⸻⸻⸻⸻⸻,"Are you also growing herbs, bushes, and trees to return carbon to the soil? The more people doing it, the better.",UC3RzKMz4PGQihsLQrGECCaQ,1,UgzAdAfR2trM-DWKcp94AaABAg,fRF245N-qPs,2020-03-05 22:30:00
92,UgzmSan7zsk_8BXKxLd4AaABAg,0.0,3,2020-03-06 17:01:40,Dissociated Women Incorporated,"So to put it another way, we&#39;re already unavoidably effed up the bottom, and if we don&#39;t take bold, serious action now, we&#39;ll be effed up the bottom without lube.",UCrIHjNlwaiK4ATA_43JLwCA,0,UgzmSan7zsk_8BXKxLd4AaABAg,fRF245N-qPs,2020-03-05 22:30:00
93,UgyE3PKSBLce3CPmnpV4AaABAg,0.0,2,2020-03-05 22:39:48,vegasflyboy67,Welcome to your cosmic Easter Island.,UCDIAkWwS5V9021aFPFOFCCw,0,UgyE3PKSBLce3CPmnpV4AaABAg,fRF245N-qPs,2020-03-05 22:30:00
94,Ugwb-3iPO32A2JvGt754AaABAg,0.0,2,2020-03-06 17:38:43,Datriax Sondor,But.... but..... but.......... profits. Think about the MONEY.,UCUwza8DDliJgICpWUMjZzLQ,0,Ugwb-3iPO32A2JvGt754AaABAg,fRF245N-qPs,2020-03-05 22:30:00
95,Ugx7xarnRVGD6b7I2tp4AaABAg,0.0,0,2020-03-06 04:26:34,Ianpact,algaboo,UCB4C1EQ7xGc22ch0vqqYelw,0,Ugx7xarnRVGD6b7I2tp4AaABAg,fRF245N-qPs,2020-03-05 22:30:00
96,UgxNFPpRd2l9fnTgWhF4AaABAg,2.0,0,2020-03-06 00:54:02,CS Ahn,i had to unsubscribe bc of your ads,UCnf728TbSf3rSMdSApdM-kg,0,UgxNFPpRd2l9fnTgWhF4AaABAg,fRF245N-qPs,2020-03-05 22:30:00
97,UgxNFPpRd2l9fnTgWhF4AaABAg.95qMpC9YV5295qasNNLVHd,,2,2020-03-06 03:05:32,filonin2,"lol, you don't know how youtube works.",UCF5-UkPMkE5JGefUq1nWq2w,1,UgxNFPpRd2l9fnTgWhF4AaABAg,fRF245N-qPs,2020-03-05 22:30:00
98,UgxNFPpRd2l9fnTgWhF4AaABAg.95qMpC9YV5295qQ09JFQXW,,1,2020-03-06 01:21:53,maccon1,"Alphabet/google picks the adds, creators have no say to what is advertised on their channel.",UC9lRYL7D47utBp92ruy9KSQ,1,UgxNFPpRd2l9fnTgWhF4AaABAg,fRF245N-qPs,2020-03-05 22:30:00
99,Ugyuvc1PyFDDoa2IrF14AaABAg,0.0,0,2020-03-06 04:36:10,Russell Henke,Dessertification v desertification,UCGQ5CyNSrbMh5AhJItf-xEQ,0,Ugyuvc1PyFDDoa2IrF14AaABAg,fRF245N-qPs,2020-03-05 22:30:00
100,UgwnW9Kd736HnsSWqUx4AaABAg,0.0,4,2020-03-06 04:49:44,BILL MURRAY,The future is shaping up to be <br />more HEAVY METAL than STAR TREK.,UC4_jeJUFXTHAVH48_5vq1_Q,0,UgwnW9Kd736HnsSWqUx4AaABAg,fRF245N-qPs,2020-03-05 22:30:00
101,UgxJDVGopFAEOdSYhCx4AaABAg,3.0,3,2020-03-06 00:16:52,facial supremacy,Now we just need to get the point across that establishment Democrats will not solve this issue. Biden will undoubtedly lie about his position on this. Biden 2034: &quot;ya know back in the 2020&#39;s I was fightin for the green new deal and I stood up to the fossil fuel industry when nobody else had the courage&quot;.,UCmmbIZ_NsdqIeHAS8_odmWA,0,UgxJDVGopFAEOdSYhCx4AaABAg,fRF245N-qPs,2020-03-05 22:30:00
102,UgxJDVGopFAEOdSYhCx4AaABAg.95qI_05M2Xu95reFFIg4c7,,0,2020-03-06 12:54:15,Dave Greene,"@⸻⸻JonBud⸻⸻⸻⸻⸻⸻⸻⸻⸻⸻⸻⸻⸻⸻⸻⸻⸻⸻⸻⸻⸻⸻⸻⸻⸻⸻⸻⸻⸻⸻⸻⸻⸻⸻⸻⸻⸻⸻⸻⸻ Not to mention that he'd ""beat them like a drum!"" Kids of that era: WTF's a ""drum""?",UCA6O_kTTtmNdh141iSvZTkw,1,UgxJDVGopFAEOdSYhCx4AaABAg,fRF245N-qPs,2020-03-05 22:30:00
103,UgxJDVGopFAEOdSYhCx4AaABAg.95qI_05M2Xu95q_wLME_oU,,0,2020-03-06 02:57:21,⸻⸻JonBud⸻⸻⸻⸻⸻⸻⸻⸻⸻⸻⸻⸻⸻⸻⸻⸻⸻⸻⸻⸻⸻⸻⸻⸻⸻⸻⸻⸻⸻⸻⸻⸻⸻⸻⸻⸻⸻⸻⸻⸻,"And these industries worked together like secret gangs... Oil, Plastics, Corn, and Soda Pop. And I told them 'hey! You punks need to be more concerned about the ocean and the air or I'd wrap up your supply chains with executive orders harsher than a rusty straight razor' and they respected me for it",UC3RzKMz4PGQihsLQrGECCaQ,1,UgxJDVGopFAEOdSYhCx4AaABAg,fRF245N-qPs,2020-03-05 22:30:00
104,UgxJDVGopFAEOdSYhCx4AaABAg.95qI_05M2Xu95qL8sloSrq,,1,2020-03-06 00:39:23,Hamish Gaffaney,"Biden won't live that long, but yer he so would",UC0m4K4Gg9zS2vB9trTDCb1w,1,UgxJDVGopFAEOdSYhCx4AaABAg,fRF245N-qPs,2020-03-05 22:30:00
105,Ugw4yJZM-JNqRwamOyB4AaABAg,0.0,10,2020-03-06 00:37:37,Comrade Jason,"If you want to show how serious it is, maybe don&#39;t put it in a segment called &quot;meanwhile in...&quot; Like, have a daily carbon tracker or do one show a week devoted to climate change. TYT should have a climate section. Stop with the Meghan McCain stories. Honestly, I hate her and I love seeing her torn to shreds, but she&#39;s not nearly as important. You do the climate no favour by treating it as anything less than a major story, if not THE major story.",UCIFku9dDE1vEJszLbfT4_xw,0,Ugw4yJZM-JNqRwamOyB4AaABAg,fRF245N-qPs,2020-03-05 22:30:00
106,Ugxzr0JjDyXWUvZofmp4AaABAg,1.0,2,2020-03-05 22:57:04,Leandro,"Bolsonaro, enemy of the Amazon Rainforest <br />Trump supports Bolsonaro 🤦🏻‍♂️",UCBDBzZ9K4paNyikufVkR2Gg,0,Ugxzr0JjDyXWUvZofmp4AaABAg,fRF245N-qPs,2020-03-05 22:30:00
107,Ugxzr0JjDyXWUvZofmp4AaABAg.95q9RS57hl295rQ9AIk2jp,,0,2020-03-06 10:42:21,Segalmed,And CPAC invited him has guest of honor this year after he waxed publicly about the time of the military dictatorship and the laws then allowing to strip citizens of their civil rights and that it will become necessary to revive them (because his critics are all in league with Cuba and plan to overthrow his regime).,UCV9_DZwovCOqtv-lRkh2Fgg,1,Ugxzr0JjDyXWUvZofmp4AaABAg,fRF245N-qPs,2020-03-05 22:30:00
108,Ugws4CUyUCUlCeCd2gN4AaABAg,3.0,5,2020-03-05 22:38:59,Renee de Suiza,"It&#39;s too late, and millions will be dislocated or suffer from environmental change, including the animal kingdom as well as plant life. We brought doom upon ourselves.",UCEQEgwVDXksc01E7cnJIv1g,0,Ugws4CUyUCUlCeCd2gN4AaABAg,fRF245N-qPs,2020-03-05 22:30:00
109,Ugws4CUyUCUlCeCd2gN4AaABAg.95q7N47efxc95qMJ6zSo8c,,0,2020-03-06 00:49:31,⸻⸻JonBud⸻⸻⸻⸻⸻⸻⸻⸻⸻⸻⸻⸻⸻⸻⸻⸻⸻⸻⸻⸻⸻⸻⸻⸻⸻⸻⸻⸻⸻⸻⸻⸻⸻⸻⸻⸻⸻⸻⸻⸻,"@Kurts aksls videos AKS If you don't mind me asking, what do you grow to help return solid carbon to the Earth? I grow pines, rhododendrons, native amaranth, herbs, and more.",UC3RzKMz4PGQihsLQrGECCaQ,1,Ugws4CUyUCUlCeCd2gN4AaABAg,fRF245N-qPs,2020-03-05 22:30:00
110,Ugws4CUyUCUlCeCd2gN4AaABAg.95q7N47efxc95qJiIK9H4g,,0,2020-03-06 00:26:53,Kurts aksls videos AKS,If we're alive it's never too late. Just print out lists of all the Republican voter scrolls so when they want in on the last of the resources we eat them instead.,UCQokIOgR_RF9D08SxvAxD2w,1,Ugws4CUyUCUlCeCd2gN4AaABAg,fRF245N-qPs,2020-03-05 22:30:00
111,Ugws4CUyUCUlCeCd2gN4AaABAg.95q7N47efxc95q7thZkspY,,0,2020-03-05 22:43:34,sairassiili,Better star reserving your very own five cubic meteres from he dome cities we'll have to escape the collapsing biosphere.,UCgv_wO1CP3hZbd44lBvMhEA,1,Ugws4CUyUCUlCeCd2gN4AaABAg,fRF245N-qPs,2020-03-05 22:30:00
112,UgxYS74zM5mCGrXpa_p4AaABAg,0.0,1,2020-03-06 04:24:41,Justin Shim,The title makes it sound like the rainforest held a press conference and said &quot;I&#39;m out MFers. You on your own now.&quot; Capturing and storing CO2 is something plants do naturally.,UCJZ-KUbgtVsfn9iI0simiuA,0,UgxYS74zM5mCGrXpa_p4AaABAg,fRF245N-qPs,2020-03-05 22:30:00
113,Ugwl02xc6xYL-ti0GLx4AaABAg,2.0,2,2020-03-06 23:00:14,JaKalen Fells,So basically we have like 10 years.,UChnWjJoc9t99ImU8-bNIKWw,0,Ugwl02xc6xYL-ti0GLx4AaABAg,fRF245N-qPs,2020-03-05 22:30:00
114,Ugwl02xc6xYL-ti0GLx4AaABAg.95sjabC4Ouu96-GPs2Mhd0,,0,2020-03-09 21:10:25,JaKalen Fells,"@Telly Vin-a I mean, they can call me what they want but it won't change the reality that things are changing :\",UChnWjJoc9t99ImU8-bNIKWw,1,Ugwl02xc6xYL-ti0GLx4AaABAg,fRF245N-qPs,2020-03-05 22:30:00
115,Ugwl02xc6xYL-ti0GLx4AaABAg.95sjabC4Ouu96-4XWxtI2D,,0,2020-03-09 19:26:36,Grant Noclearance,"Less, because stored carbon is already being released from deforesting, burning rainforest, melting permafrost (which is also killing trees there), which no longer will hold as much carbon, which all together excelerated the rate of change. It's changing faster.",UCI2JSk2w4IW7krzMWEjvLSQ,1,Ugwl02xc6xYL-ti0GLx4AaABAg,fRF245N-qPs,2020-03-05 22:30:00
116,UgzYVnhY_xIV-ZtXtYd4AaABAg,6.0,0,2020-03-05 22:35:22,The Poltical One,FFS I was hoping this was one of those exaggerated clickbait titles,UCrKZy0VFS9Uisao_f0FJyzA,0,UgzYVnhY_xIV-ZtXtYd4AaABAg,fRF245N-qPs,2020-03-05 22:30:00
117,UgzYVnhY_xIV-ZtXtYd4AaABAg.95q6xW4304U95qC2zn2p35,,0,2020-03-05 23:19:56,The Poltical One,@sairassiili it's going to have to be a big Western city. I just don't know which one it will happen to,UCrKZy0VFS9Uisao_f0FJyzA,1,UgzYVnhY_xIV-ZtXtYd4AaABAg,fRF245N-qPs,2020-03-05 22:30:00
118,UgzYVnhY_xIV-ZtXtYd4AaABAg.95q6xW4304U95qBZcpQXcp,,0,2020-03-05 23:15:39,sairassiili,"@The Poltical One Societies are capable of acting drastically when faced with an immediate crisis, as proven with the ozone layer threat. Problems are that when climate change reaches critical point, its too late to change things, and that climate change is not exaggerated by one element of society, but by the whole structure. A major city with big image being unexpectedly and devastatingly hit might remind people that things will and have already changed, and the only question is are we going to make the change, or suffer it.",UCgv_wO1CP3hZbd44lBvMhEA,1,UgzYVnhY_xIV-ZtXtYd4AaABAg,fRF245N-qPs,2020-03-05 22:30:00
119,UgzYVnhY_xIV-ZtXtYd4AaABAg.95q6xW4304U95q9IqzbQFv,,0,2020-03-05 22:55:53,The Poltical One,@sairassiili damn but I doubt even it would made a difference. By the time it's too late will we realise how badly we messed up. We can see the warning signs but it's still not enough,UCrKZy0VFS9Uisao_f0FJyzA,1,UgzYVnhY_xIV-ZtXtYd4AaABAg,fRF245N-qPs,2020-03-05 22:30:00
120,UgzYVnhY_xIV-ZtXtYd4AaABAg.95q6xW4304U95q8u1RDEIZ,,0,2020-03-05 22:52:21,sairassiili,"@The Poltical One I was hoping that Sydney would have burned on the Australian bush fires, because maybe the footage of the opera house in flames would have gotten the world's governments moving.",UCgv_wO1CP3hZbd44lBvMhEA,1,UgzYVnhY_xIV-ZtXtYd4AaABAg,fRF245N-qPs,2020-03-05 22:30:00
121,UgzYVnhY_xIV-ZtXtYd4AaABAg.95q6xW4304U95q8GVQX0Gs,,0,2020-03-05 22:46:50,The Poltical One,@sairassiili if only,UCrKZy0VFS9Uisao_f0FJyzA,1,UgzYVnhY_xIV-ZtXtYd4AaABAg,fRF245N-qPs,2020-03-05 22:30:00
122,UgzYVnhY_xIV-ZtXtYd4AaABAg.95q6xW4304U95q878Z7U3U,,0,2020-03-05 22:45:33,sairassiili,"Haha, no.",UCgv_wO1CP3hZbd44lBvMhEA,1,UgzYVnhY_xIV-ZtXtYd4AaABAg,fRF245N-qPs,2020-03-05 22:30:00
123,UgyvypAgr8KvjFnKsUx4AaABAg,1.0,1,2020-03-05 23:41:48,Ryan Ericksen,Goodbye world.,UCXXYG1_xHFlupJkH71WC-Sg,0,UgyvypAgr8KvjFnKsUx4AaABAg,fRF245N-qPs,2020-03-05 22:30:00
124,UgyvypAgr8KvjFnKsUx4AaABAg.95qEZAR8Frj95qWDr5VjFF,,0,2020-03-06 02:16:11,Ronin Dave,more like goodbye humans,UCRqHidcZHU6lJeF8ApsAtoA,1,UgyvypAgr8KvjFnKsUx4AaABAg,fRF245N-qPs,2020-03-05 22:30:00
125,UgyFYtIm-LaBRPPsBDB4AaABAg,0.0,0,2020-03-05 22:44:52,Josh Calhov,Instead of using our military to fight for oil when we use it to protect the Amazon rain forest,UCm7aYlYJCLZAsPWt-9kiPwg,0,UgyFYtIm-LaBRPPsBDB4AaABAg,fRF245N-qPs,2020-03-05 22:30:00
126,UgzZrM6hp6-m5n6ss4l4AaABAg,3.0,8,2020-03-06 02:41:11,Uni Peace,Nature: People are the problem; they ought to be eliminated.,UCiXkhCq8oRO9amnVpv1IZPA,0,UgzZrM6hp6-m5n6ss4l4AaABAg,fRF245N-qPs,2020-03-05 22:30:00
127,UgzZrM6hp6-m5n6ss4l4AaABAg.95qZ519c3j595r_dVGq6vV,,0,2020-03-06 12:14:01,Dave Greene,"Nah, just the evil ones! The rest are welcome to stay, thrive. and enjoy!!!",UCA6O_kTTtmNdh141iSvZTkw,1,UgzZrM6hp6-m5n6ss4l4AaABAg,fRF245N-qPs,2020-03-05 22:30:00
128,UgzZrM6hp6-m5n6ss4l4AaABAg.95qZ519c3j595r5lCil6Yn,,0,2020-03-06 07:44:11,draenoss,*Coronavirus joined chat*,UCjWcuntDXTmXA0-1vxFI6Sg,1,UgzZrM6hp6-m5n6ss4l4AaABAg,fRF245N-qPs,2020-03-05 22:30:00
129,UgzZrM6hp6-m5n6ss4l4AaABAg.95qZ519c3j595q_xOj_yBu,,2,2020-03-06 02:57:29,darknite 123222,You first.,UCWe987yhVaZPYxZLr67yRdQ,1,UgzZrM6hp6-m5n6ss4l4AaABAg,fRF245N-qPs,2020-03-05 22:30:00
130,UgwZG-773IeGW7ibelB4AaABAg,0.0,0,2020-03-05 23:35:25,Frank Castle,"In other words, the jungle is burning down - and no one is doing anything about it...",UC3yAAqDq0KZUWYetVicD_Mw,0,UgwZG-773IeGW7ibelB4AaABAg,fRF245N-qPs,2020-03-05 22:30:00
131,UgwONH-atCOg0ud2t-t4AaABAg,0.0,0,2020-03-05 23:20:26,Zid96,For some reason the little dude from the Lorax moive pop in head singing. Let it die. Let it die. Let it shrivel up and die.,UCGiy5jEljdsb_zP59NWA9Ng,0,UgwONH-atCOg0ud2t-t4AaABAg,fRF245N-qPs,2020-03-05 22:30:00
132,UgxLAUMmm0aUn-C3ihR4AaABAg,1.0,1,2020-03-06 03:31:33,SteveBofearth,Don&#39;t tell Trump or he&#39;ll declare war on trees.,UC9daN45AvzbgkS0otzvenzw,0,UgxLAUMmm0aUn-C3ihR4AaABAg,fRF245N-qPs,2020-03-05 22:30:00
133,UgxLAUMmm0aUn-C3ihR4AaABAg.95qdqqb1z5g95r_Ciwz6aG,,0,2020-03-06 12:10:13,Dave Greene,He/it already IS!,UCA6O_kTTtmNdh141iSvZTkw,1,UgxLAUMmm0aUn-C3ihR4AaABAg,fRF245N-qPs,2020-03-05 22:30:00
134,Ugx8nEuYa6d52FpKWMp4AaABAg,3.0,2,2020-03-07 16:08:29,Plush Prince,You do realize plants survive on co2? How could they stop absorbing co2 and still exist? Fake science...,UCu8o8AHkbxrKegyzZlEd0Lw,0,Ugx8nEuYa6d52FpKWMp4AaABAg,fRF245N-qPs,2020-03-05 22:30:00
135,Ugx8nEuYa6d52FpKWMp4AaABAg.95u_GetI8_A95vXKF3hcSy,,0,2020-03-08 01:02:00,Leto Kahn,"You breathe out CO2, moron.",UCwOJFU-RaF-3aoghgOupqXw,1,Ugx8nEuYa6d52FpKWMp4AaABAg,fRF245N-qPs,2020-03-05 22:30:00
136,Ugx8nEuYa6d52FpKWMp4AaABAg.95u_GetI8_A95udJQ0YCtI,,2,2020-03-07 16:43:48,Sangui,"If you actually watched the segment, you might have understood this. Also though, it takes a lot of trees to convert co2 at a sustainable rate, and we've been removing a lot of trees from the largest concentration of trees that we have. There is a reason that the rainforest is called the planet's lungs, and we've been hacking away at them for decades without stopping.",UCfZH6PiMJ3-Gl9ziD4GfjdA,1,Ugx8nEuYa6d52FpKWMp4AaABAg,fRF245N-qPs,2020-03-05 22:30:00
